{
  "schemaVersion": "1.0",
  "generatedAt": "2026-09-04T00:00:00Z",
  "corpus": {
    "corpusId": "ml/data/klangio",
    "corpusSha256": "4880faceab27217640701f1b93db477606d5fb3aa2c4434574040b6590315827",
    "recordingCount": 82,
    "eventCount": 11767,
    "skippedRecordingCount": 0
  },
  "appCommit": "5ceed22d",
  "appCommitNote": "Chord and onset numbers were produced at app commit 5ceed22d (E99-R04, GOV-06). The BPM claim from that same run was retracted at app commit c4ce2cc0 (E99-R05, GOV-06b) and replaced by an independent librosa beat-track reference comparison; see the bpm.retractedReason field.",
  "configuration": {
    "chunkSize": 2048,
    "strumRefiner": null,
    "chromaMedianWindow": 1,
    "bassWeight": null
  },
  "models": [],
  "modelsRationale": "The measured baseline ran the unmodified const ClipAnalyzer() (lib/features/analyze/engine/clip_analyzer.dart:36 as of app commit 5ceed22d), whose strumRefiner defaults to null. Because no strum-refiner model was configured, no assets/ml/*.bin weight participated in this measurement — the empty models array reflects that fact, not an omission (ADR 0354 D7).",
  "metricBlocks": {
    "chord": {
      "status": "measured",
      "metrics": {
        "accuracy": {
          "value": 0.6706892156029575,
          "n": 11767,
          "unit": "ratio",
          "sourceFile": "docs/eval/real-audio-dsp-baseline.md",
          "command": "~/flutter/bin/flutter test --dart-define=REAL_AUDIO_DSP_BASELINE_CORPUS=ml/data/klangio --dart-define=REAL_AUDIO_DSP_TEMPO_REFERENCE=/tmp/tempo_reference.json tool/benchmarks/real_audio_dsp_baseline.dart",
          "note": "7892/11767 correct chord labels across the full corpus."
        },
        "majorityClassBaselineAccuracy": {
          "value": 0.1883232769609926,
          "n": 11767,
          "unit": "ratio",
          "sourceFile": "docs/eval/real-audio-dsp-baseline.md",
          "command": "~/flutter/bin/flutter test --dart-define=REAL_AUDIO_DSP_BASELINE_CORPUS=ml/data/klangio --dart-define=REAL_AUDIO_DSP_TEMPO_REFERENCE=/tmp/tempo_reference.json tool/benchmarks/real_audio_dsp_baseline.dart",
          "note": "Always-predict-G-major baseline: 2216/11767 correct."
        },
        "minorSubsetAccuracy": {
          "value": 0.8333333333333334,
          "n": 222,
          "unit": "ratio",
          "sourceFile": "docs/eval/real-audio-dsp-baseline.md",
          "command": "~/flutter/bin/flutter test --dart-define=REAL_AUDIO_DSP_BASELINE_CORPUS=ml/data/klangio --dart-define=REAL_AUDIO_DSP_TEMPO_REFERENCE=/tmp/tempo_reference.json tool/benchmarks/real_audio_dsp_baseline.dart",
          "note": "185/222 correct on the minor-chord subset only."
        },
        "perLabel.A-major.precision": {
          "value": 0.8832288401253918,
          "n": 1546,
          "unit": "ratio",
          "sourceFile": "docs/eval/real-audio-dsp-baseline.md",
          "command": "~/flutter/bin/flutter test --dart-define=REAL_AUDIO_DSP_BASELINE_CORPUS=ml/data/klangio --dart-define=REAL_AUDIO_DSP_TEMPO_REFERENCE=/tmp/tempo_reference.json tool/benchmarks/real_audio_dsp_baseline.dart"
        },
        "perLabel.A-major.recall": {
          "value": 0.7289780077619664,
          "n": 1546,
          "unit": "ratio",
          "sourceFile": "docs/eval/real-audio-dsp-baseline.md",
          "command": "~/flutter/bin/flutter test --dart-define=REAL_AUDIO_DSP_BASELINE_CORPUS=ml/data/klangio --dart-define=REAL_AUDIO_DSP_TEMPO_REFERENCE=/tmp/tempo_reference.json tool/benchmarks/real_audio_dsp_baseline.dart"
        },
        "perLabel.A-minor.precision": {
          "value": 0.6722689075630253,
          "n": 98,
          "unit": "ratio",
          "sourceFile": "docs/eval/real-audio-dsp-baseline.md",
          "command": "~/flutter/bin/flutter test --dart-define=REAL_AUDIO_DSP_BASELINE_CORPUS=ml/data/klangio --dart-define=REAL_AUDIO_DSP_TEMPO_REFERENCE=/tmp/tempo_reference.json tool/benchmarks/real_audio_dsp_baseline.dart"
        },
        "perLabel.A-minor.recall": {
          "value": 0.8163265306122449,
          "n": 98,
          "unit": "ratio",
          "sourceFile": "docs/eval/real-audio-dsp-baseline.md",
          "command": "~/flutter/bin/flutter test --dart-define=REAL_AUDIO_DSP_BASELINE_CORPUS=ml/data/klangio --dart-define=REAL_AUDIO_DSP_TEMPO_REFERENCE=/tmp/tempo_reference.json tool/benchmarks/real_audio_dsp_baseline.dart"
        },
        "perLabel.B-major.precision": {
          "value": 0.9394703656998739,
          "n": 860,
          "unit": "ratio",
          "sourceFile": "docs/eval/real-audio-dsp-baseline.md",
          "command": "~/flutter/bin/flutter test --dart-define=REAL_AUDIO_DSP_BASELINE_CORPUS=ml/data/klangio --dart-define=REAL_AUDIO_DSP_TEMPO_REFERENCE=/tmp/tempo_reference.json tool/benchmarks/real_audio_dsp_baseline.dart"
        },
        "perLabel.B-major.recall": {
          "value": 0.8662790697674418,
          "n": 860,
          "unit": "ratio",
          "sourceFile": "docs/eval/real-audio-dsp-baseline.md",
          "command": "~/flutter/bin/flutter test --dart-define=REAL_AUDIO_DSP_BASELINE_CORPUS=ml/data/klangio --dart-define=REAL_AUDIO_DSP_TEMPO_REFERENCE=/tmp/tempo_reference.json tool/benchmarks/real_audio_dsp_baseline.dart"
        },
        "perLabel.B-minor.precision": {
          "value": 0.8823529411764706,
          "n": 124,
          "unit": "ratio",
          "sourceFile": "docs/eval/real-audio-dsp-baseline.md",
          "command": "~/flutter/bin/flutter test --dart-define=REAL_AUDIO_DSP_BASELINE_CORPUS=ml/data/klangio --dart-define=REAL_AUDIO_DSP_TEMPO_REFERENCE=/tmp/tempo_reference.json tool/benchmarks/real_audio_dsp_baseline.dart"
        },
        "perLabel.B-minor.recall": {
          "value": 0.8467741935483871,
          "n": 124,
          "unit": "ratio",
          "sourceFile": "docs/eval/real-audio-dsp-baseline.md",
          "command": "~/flutter/bin/flutter test --dart-define=REAL_AUDIO_DSP_BASELINE_CORPUS=ml/data/klangio --dart-define=REAL_AUDIO_DSP_TEMPO_REFERENCE=/tmp/tempo_reference.json tool/benchmarks/real_audio_dsp_baseline.dart"
        },
        "perLabel.Bb-major.precision": {
          "value": 0.9520958083832335,
          "n": 284,
          "unit": "ratio",
          "sourceFile": "docs/eval/real-audio-dsp-baseline.md",
          "command": "~/flutter/bin/flutter test --dart-define=REAL_AUDIO_DSP_BASELINE_CORPUS=ml/data/klangio --dart-define=REAL_AUDIO_DSP_TEMPO_REFERENCE=/tmp/tempo_reference.json tool/benchmarks/real_audio_dsp_baseline.dart"
        },
        "perLabel.Bb-major.recall": {
          "value": 0.5598591549295775,
          "n": 284,
          "unit": "ratio",
          "sourceFile": "docs/eval/real-audio-dsp-baseline.md",
          "command": "~/flutter/bin/flutter test --dart-define=REAL_AUDIO_DSP_BASELINE_CORPUS=ml/data/klangio --dart-define=REAL_AUDIO_DSP_TEMPO_REFERENCE=/tmp/tempo_reference.json tool/benchmarks/real_audio_dsp_baseline.dart"
        },
        "perLabel.C#-major.precision": {
          "value": 0.0,
          "n": 138,
          "unit": "ratio",
          "sourceFile": "docs/eval/real-audio-dsp-baseline.md",
          "command": "~/flutter/bin/flutter test --dart-define=REAL_AUDIO_DSP_BASELINE_CORPUS=ml/data/klangio --dart-define=REAL_AUDIO_DSP_TEMPO_REFERENCE=/tmp/tempo_reference.json tool/benchmarks/real_audio_dsp_baseline.dart",
          "note": "0/138: the detector never predicted C#-major correctly on this corpus."
        },
        "perLabel.C#-major.recall": {
          "value": 0.0,
          "n": 138,
          "unit": "ratio",
          "sourceFile": "docs/eval/real-audio-dsp-baseline.md",
          "command": "~/flutter/bin/flutter test --dart-define=REAL_AUDIO_DSP_BASELINE_CORPUS=ml/data/klangio --dart-define=REAL_AUDIO_DSP_TEMPO_REFERENCE=/tmp/tempo_reference.json tool/benchmarks/real_audio_dsp_baseline.dart",
          "note": "0/138: the detector never predicted C#-major correctly on this corpus."
        },
        "perLabel.C-major.precision": {
          "value": 0.8497772119669,
          "n": 1982,
          "unit": "ratio",
          "sourceFile": "docs/eval/real-audio-dsp-baseline.md",
          "command": "~/flutter/bin/flutter test --dart-define=REAL_AUDIO_DSP_BASELINE_CORPUS=ml/data/klangio --dart-define=REAL_AUDIO_DSP_TEMPO_REFERENCE=/tmp/tempo_reference.json tool/benchmarks/real_audio_dsp_baseline.dart"
        },
        "perLabel.C-major.recall": {
          "value": 0.6735620585267407,
          "n": 1982,
          "unit": "ratio",
          "sourceFile": "docs/eval/real-audio-dsp-baseline.md",
          "command": "~/flutter/bin/flutter test --dart-define=REAL_AUDIO_DSP_BASELINE_CORPUS=ml/data/klangio --dart-define=REAL_AUDIO_DSP_TEMPO_REFERENCE=/tmp/tempo_reference.json tool/benchmarks/real_audio_dsp_baseline.dart"
        },
        "perLabel.D-major.precision": {
          "value": 0.8984468339307049,
          "n": 1804,
          "unit": "ratio",
          "sourceFile": "docs/eval/real-audio-dsp-baseline.md",
          "command": "~/flutter/bin/flutter test --dart-define=REAL_AUDIO_DSP_BASELINE_CORPUS=ml/data/klangio --dart-define=REAL_AUDIO_DSP_TEMPO_REFERENCE=/tmp/tempo_reference.json tool/benchmarks/real_audio_dsp_baseline.dart"
        },
        "perLabel.D-major.recall": {
          "value": 0.41685144124168516,
          "n": 1804,
          "unit": "ratio",
          "sourceFile": "docs/eval/real-audio-dsp-baseline.md",
          "command": "~/flutter/bin/flutter test --dart-define=REAL_AUDIO_DSP_BASELINE_CORPUS=ml/data/klangio --dart-define=REAL_AUDIO_DSP_TEMPO_REFERENCE=/tmp/tempo_reference.json tool/benchmarks/real_audio_dsp_baseline.dart"
        },
        "perLabel.E-major.precision": {
          "value": 0.8276119402985075,
          "n": 1283,
          "unit": "ratio",
          "sourceFile": "docs/eval/real-audio-dsp-baseline.md",